{
  "id": "aiman.kev",
  "type": "decision_model",
  "name": "AIMAN-Kev specialization on Laya",
  "domains": [
    "*"
  ],
  "capabilities": [
    "task_classify",
    "route_hint",
    "risk_assess",
    "evidence_policy"
  ],
  "protocols": [
    "jev_systemone_http",
    "laya_native_http"
  ],
  "provenance": "supported",
  "freshness": {
    "model": "versioned",
    "runtime": "upstream_laya"
  },
  "write_policy": {
    "execution": "advisory_only"
  },
  "execution": {
    "target": "agentdock",
    "adapter": "laya",
    "compatibility_adapter": "kev"
  },
  "priority": 80,
  "enabled": true
}
